[
  {
    "item_id": "aero001",
    "source_url": "https://www.thedrive.com/the-war-zone/f-35-stealth-test",
    "source_name": "The Drive",
    "title": "Air Force Confirms F-35 Stealth Coating Defect Found During Flight Test",
    "body_text": "The Pentagon disclosed today that a significant stealth coating defect was identified on F-35 fighter jets during routine flight test operations at Edwards Air Force Base. Lockheed Martin engineers are working to resolve the issue.",
    "published_at": "2026-07-01T10:00:00+00:00",
    "captured_at": "2026-07-01T11:00:00+00:00",
    "evidence_tier": "T1",
    "labels": ["MILITARY_AEROSPACE"],
    "confidence": 0.95,
    "classifier_reasoning": "Keyword match: stealth, flight test, air force, Lockheed"
  },
  {
    "item_id": "env001",
    "source_url": "https://insideclimatenews.org/coral-reef-bleaching-2026",
    "source_name": "Inside Climate News",
    "title": "Third Consecutive Year of Coral Reef Bleaching Detected Across Caribbean",
    "body_text": "NOAA scientists confirmed record sea surface temperatures are causing mass coral reef bleaching across the Caribbean for the third consecutive year. Biodiversity loss from the bleaching events threatens coastal ecosystems and local fisheries.",
    "published_at": "2026-07-01T08:00:00+00:00",
    "captured_at": "2026-07-01T09:00:00+00:00",
    "evidence_tier": "T1",
    "labels": ["ENVIRONMENTAL"],
    "confidence": 0.92,
    "classifier_reasoning": "Keyword match: coral reef, NOAA, sea level, biodiversity, ecosystem"
  },
  {
    "item_id": "geo001",
    "source_url": "https://earthquake.usgs.gov/earthquakes/eventpage/us7000abc",
    "source_name": "USGS Earthquakes",
    "title": "Magnitude 6.8 Earthquake Strikes Off Coast of Puerto Rico",
    "body_text": "USGS reports a magnitude 6.8 earthquake struck 45km north of San Juan, Puerto Rico at 03:14 UTC. The seismic event was felt across the island. A tsunami advisory has been issued. Tectonic plate movement along the Puerto Rico Trench fault line is believed responsible.",
    "published_at": "2026-07-01T03:30:00+00:00",
    "captured_at": "2026-07-01T03:35:00+00:00",
    "evidence_tier": "T1",
    "labels": ["GEO_GEOLOGY"],
    "confidence": 0.98,
    "classifier_reasoning": "Keyword match: magnitude, earthquake, seismic, USGS, fault line, tsunami"
  },
  {
    "item_id": "fin001",
    "source_url": "https://www.reuters.com/business/federal-reserve-rate-cut",
    "source_name": "Reuters Business",
    "title": "Federal Reserve Signals Potential Interest Rate Cut Amid Inflation Data",
    "body_text": "The Federal Reserve indicated it may cut interest rates at its next meeting following new inflation data showing GDP growth slowing. Bond yields fell sharply while the stock market rallied on the news. Treasury officials confirmed a revised economic outlook.",
    "published_at": "2026-07-01T14:00:00+00:00",
    "captured_at": "2026-07-01T14:05:00+00:00",
    "evidence_tier": "T1",
    "labels": ["FINANCIAL"],
    "confidence": 0.94,
    "classifier_reasoning": "Keyword match: federal reserve, interest rate, inflation, GDP, bond yield, treasury"
  },
  {
    "item_id": "pol001",
    "source_url": "https://foreignpolicy.com/nato-summit-2026",
    "source_name": "Foreign Policy",
    "title": "NATO Summit Produces New Defense Spending Agreement Amid Geopolitical Tensions",
    "body_text": "Leaders at the NATO summit agreed to increase defense spending targets following escalating geopolitical tensions. The treaty includes provisions for joint military exercises. Several parliaments must ratify the agreement before it takes effect.",
    "published_at": "2026-07-01T16:00:00+00:00",
    "captured_at": "2026-07-01T16:10:00+00:00",
    "evidence_tier": "T1",
    "labels": ["POLITICAL", "MILITARY_AEROSPACE"],
    "confidence": 0.88,
    "classifier_reasoning": "Multi-label: NATO/defense (MILITARY_AEROSPACE) + treaty/parliament/geopolitics (POLITICAL)"
  },
  {
    "item_id": "uap001",
    "source_url": "https://www.theblackvault.com/uap-navy-2026",
    "source_name": "The Black Vault",
    "title": "Navy Pilot Reports Unidentified Aerial Phenomenon During Training Exercise",
    "body_text": "A Navy pilot filed an official UAP report after encountering an unidentified aerial phenomenon during a training exercise off the coast of Virginia. The object exhibited anomalous flight characteristics inconsistent with known aircraft. SETI researchers have been notified.",
    "published_at": "2026-07-01T12:00:00+00:00",
    "captured_at": "2026-07-01T12:15:00+00:00",
    "evidence_tier": "T2",
    "labels": ["ANOMALOUS", "MILITARY_AEROSPACE"],
    "confidence": 0.75,
    "classifier_reasoning": "Multi-label: UAP/unidentified/SETI (ANOMALOUS) + navy/military (MILITARY_AEROSPACE)"
  },
  {
    "item_id": "multi001",
    "source_url": "https://spacenews.com/satellite-climate-monitoring",
    "source_name": "Space News",
    "title": "Pentagon Awards $2B Contract for Climate Monitoring Satellite Constellation",
    "body_text": "The Pentagon awarded a $2 billion contract to aerospace companies including Boeing Defense and Northrop Grumman to build a climate monitoring satellite constellation. The satellites will track carbon emissions, deforestation, and sea level rise. The contract follows a Congressional bill authorizing the program.",
    "published_at": "2026-07-01T13:00:00+00:00",
    "captured_at": "2026-07-01T13:05:00+00:00",
    "evidence_tier": "T1",
    "labels": ["MILITARY_AEROSPACE", "ENVIRONMENTAL", "POLITICAL"],
    "confidence": 0.82,
    "classifier_reasoning": "Multi-label: pentagon/boeing defense/northrop (MILITARY_AEROSPACE) + carbon/deforestation/sea level (ENVIRONMENTAL) + bill passed/congress (POLITICAL)"
  },
  {
    "item_id": "unc001",
    "source_url": "https://example.com/random-article",
    "source_name": "Unknown Blog",
    "title": "Local Restaurant Reviews in San Juan",
    "body_text": "A roundup of the best new restaurants that opened in the Condado area this month. From tapas to fusion cuisine, there is something for everyone.",
    "published_at": "2026-07-01T09:00:00+00:00",
    "captured_at": "2026-07-01T09:05:00+00:00",
    "evidence_tier": "T3",
    "labels": ["UNCLASSIFIED"],
    "confidence": 0.1,
    "classifier_reasoning": "No domain keywords matched; LLM confirmed unclassified"
  }
]
